{"asof":"2026-10-20","election_date":"2027-05-02","pairs":[{"candidate_a":"le_pen_marine","candidate_b":"philippe_edouard","p_pair":0.3657,"p_a_wins":0.5822,"share_a":{"q05":41.3,"q25":47.2,"q50":51.1,"q75":55.4,"q95":61.2}},{"candidate_a":"le_pen_marine","candidate_b":"melenchon_jean_luc","p_pair":0.2885,"p_a_wins":0.7903,"share_a":{"q05":45.1,"q25":50.9,"q50":54.9,"q75":59,"q95":64.8}},{"candidate_a":"le_pen_marine","candidate_b":"glucksmann_raphael","p_pair":0.1454,"p_a_wins":0.7228,"share_a":{"q05":44.1,"q25":49.4,"q50":53.8,"q75":57.7,"q95":63.6}},{"candidate_a":"bardella_jordan","candidate_b":"philippe_edouard","p_pair":0.0514,"p_a_wins":0.5272,"share_a":{"q05":40.4,"q25":46.1,"q50":50.2,"q75":54.5,"q95":60.8}},{"candidate_a":"bardella_jordan","candidate_b":"melenchon_jean_luc","p_pair":0.0421,"p_a_wins":0.7601,"share_a":{"q05":45.1,"q25":50.3,"q50":54,"q75":57.6,"q95":64.6}},{"candidate_a":"le_pen_marine","candidate_b":"attal_gabriel","p_pair":0.0343,"p_a_wins":0.7172,"share_a":{"q05":43.6,"q25":49.1,"q50":53.2,"q75":58,"q95":62.7}},{"candidate_a":"le_pen_marine","candidate_b":"placeholder_centre","p_pair":0.03,"p_a_wins":0.6267,"share_a":{"q05":43.2,"q25":47.8,"q50":52.3,"q75":56.6,"q95":62.9}},{"candidate_a":"bardella_jordan","candidate_b":"glucksmann_raphael","p_pair":0.0195,"p_a_wins":0.6513,"share_a":{"q05":42.8,"q25":48.2,"q50":52.2,"q75":56.4,"q95":62.1}},{"candidate_a":"bardella_jordan","candidate_b":"placeholder_centre","p_pair":0.005,"p_a_wins":0.62,"share_a":{"q05":45.7,"q25":48.4,"q50":51.5,"q75":54.8,"q95":59.6}},{"candidate_a":"bardella_jordan","candidate_b":"attal_gabriel","p_pair":0.0046,"p_a_wins":0.6304,"share_a":{"q05":40.9,"q25":47.1,"q50":51.6,"q75":54.9,"q95":60.3}},{"candidate_a":"melenchon_jean_luc","candidate_b":"philippe_edouard","p_pair":0.0039,"p_a_wins":0.1795,"share_a":{"q05":38.9,"q25":41.8,"q50":44.7,"q75":47.4,"q95":53.8}},{"candidate_a":"le_pen_marine","candidate_b":"retailleau_bruno","p_pair":0.0035,"p_a_wins":0.8857,"share_a":{"q05":46.7,"q25":53.6,"q50":55.7,"q75":58.4,"q95":63.4}},{"candidate_a":"philippe_edouard","candidate_b":"glucksmann_raphael","p_pair":0.0027,"p_a_wins":0.9259,"share_a":{"q05":49.9,"q25":52,"q50":54.4,"q75":56.3,"q95":61.6}}],"transfers":[{"candidate_a":"le_pen_marine","candidate_b":"philippe_edouard","from":"glucksmann_raphael","to_a":{"q05":3,"q25":4,"q50":5,"q75":7,"q95":10},"to_b":{"q05":44,"q25":55,"q50":61,"q75":67,"q95":75},"to_none":{"q05":20,"q25":27,"q50":33,"q75":39,"q95":49}},{"candidate_a":"le_pen_marine","candidate_b":"philippe_edouard","from":"tondelier_marine","to_a":{"q05":3,"q25":4,"q50":5,"q75":7,"q95":10},"to_b":{"q05":45,"q25":54,"q50":61,"q75":67,"q95":75},"to_none":{"q05":20,"q25":28,"q50":33,"q75":40,"q95":50}},{"candidate_a":"le_pen_marine","candidate_b":"philippe_edouard","from":"retailleau_bruno","to_a":{"q05":19,"q25":25,"q50":29,"q75":35,"q95":44},"to_b":{"q05":33,"q25":41,"q50":48,"q75":54,"q95":62},"to_none":{"q05":13,"q25":17,"q50":21,"q75":26,"q95":33}},{"candidate_a":"le_pen_marine","candidate_b":"philippe_edouard","from":"melenchon_jean_luc","to_a":{"q05":13,"q25":17,"q50":21,"q75":25,"q95":32},"to_b":{"q05":16,"q25":21,"q50":26,"q75":31,"q95":39},"to_none":{"q05":37,"q25":46,"q50":52,"q75":58,"q95":67}},{"candidate_a":"le_pen_marine","candidate_b":"philippe_edouard","from":"zemmour_eric","to_a":{"q05":59,"q25":68,"q50":73,"q75":77,"q95":83},"to_b":{"q05":5,"q25":7,"q50":9,"q75":11,"q95":15},"to_none":{"q05":10,"q25":14,"q50":18,"q75":22,"q95":30}},{"candidate_a":"le_pen_marine","candidate_b":"philippe_edouard","from":"dupont_aignan_nicolas","to_a":{"q05":59,"q25":67,"q50":72,"q75":77,"q95":83},"to_b":{"q05":5,"q25":7,"q50":9,"q75":11,"q95":16},"to_none":{"q05":11,"q25":14,"q50":18,"q75":23,"q95":31}},{"candidate_a":"le_pen_marine","candidate_b":"philippe_edouard","from":"bertrand_xavier","to_a":{"q05":19,"q25":25,"q50":30,"q75":36,"q95":45},"to_b":{"q05":33,"q25":41,"q50":47,"q75":53,"q95":63},"to_none":{"q05":13,"q25":17,"q50":22,"q75":26,"q95":34}},{"candidate_a":"le_pen_marine","candidate_b":"philippe_edouard","from":"lisnard_david","to_a":{"q05":19,"q25":25,"q50":30,"q75":36,"q95":44},"to_b":{"q05":33,"q25":41,"q50":47,"q75":53,"q95":63},"to_none":{"q05":13,"q25":17,"q50":21,"q75":26,"q95":33}},{"candidate_a":"le_pen_marine","candidate_b":"philippe_edouard","from":"hollande_francois","to_a":{"q05":3,"q25":4,"q50":5,"q75":7,"q95":10},"to_b":{"q05":44,"q25":55,"q50":61,"q75":67,"q95":75},"to_none":{"q05":20,"q25":28,"q50":33,"q75":39,"q95":49}},{"candidate_a":"le_pen_marine","candidate_b":"philippe_edouard","from":"roussel_fabien","to_a":{"q05":13,"q25":17,"q50":21,"q75":25,"q95":32},"to_b":{"q05":16,"q25":21,"q50":26,"q75":31,"q95":40},"to_none":{"q05":37,"q25":46,"q50":52,"q75":58,"q95":67}},{"candidate_a":"le_pen_marine","candidate_b":"philippe_edouard","from":"lassalle_jean","to_a":{"q05":18,"q25":25,"q50":30,"q75":35,"q95":44},"to_b":{"q05":12,"q25":16,"q50":19,"q75":24,"q95":32},"to_none":{"q05":34,"q25":43,"q50":49,"q75":55,"q95":64}},{"candidate_a":"le_pen_marine","candidate_b":"philippe_edouard","from":"de_villepin_dominique","to_a":{"q05":18,"q25":25,"q50":29,"q75":35,"q95":44},"to_b":{"q05":12,"q25":16,"q50":20,"q75":24,"q95":32},"to_none":{"q05":35,"q25":43,"q50":50,"q75":56,"q95":64}},{"candidate_a":"le_pen_marine","candidate_b":"philippe_edouard","from":"attal_gabriel","to_a":{"q05":3,"q25":5,"q50":6,"q75":8,"q95":11},"to_b":{"q05":62,"q25":70,"q50":75,"q75":79,"q95":84},"to_none":{"q05":11,"q25":15,"q50":19,"q75":23,"q95":30}},{"candidate_a":"le_pen_marine","candidate_b":"philippe_edouard","from":"ruffin_francois","to_a":{"q05":12,"q25":17,"q50":21,"q75":25,"q95":32},"to_b":{"q05":16,"q25":22,"q50":26,"q75":31,"q95":40},"to_none":{"q05":37,"q25":46,"q50":52,"q75":58,"q95":67}},{"candidate_a":"le_pen_marine","candidate_b":"philippe_edouard","from":"cazeneuve_bernard","to_a":{"q05":3,"q25":4,"q50":6,"q75":7,"q95":9},"to_b":{"q05":44,"q25":54,"q50":61,"q75":67,"q95":75},"to_none":{"q05":20,"q25":27,"q50":33,"q75":40,"q95":49}},{"candidate_a":"le_pen_marine","candidate_b":"philippe_edouard","from":"asselineau_francois","to_a":{"q05":18,"q25":25,"q50":30,"q75":35,"q95":43},"to_b":{"q05":12,"q25":16,"q50":19,"q75":24,"q95":30},"to_none":{"q05":35,"q25":44,"q50":50,"q75":56,"q95":65}},{"candidate_a":"le_pen_marine","candidate_b":"philippe_edouard","from":"arthaud_nathalie","to_a":{"q05":13,"q25":16,"q50":20,"q75":23,"q95":32},"to_b":{"q05":16,"q25":20,"q50":25,"q75":31,"q95":37},"to_none":{"q05":40,"q25":49,"q50":54,"q75":61,"q95":67}},{"candidate_a":"le_pen_marine","candidate_b":"philippe_edouard","from":"polony_natacha","to_a":{"q05":18,"q25":24,"q50":29,"q75":35,"q95":44},"to_b":{"q05":12,"q25":16,"q50":19,"q75":24,"q95":32},"to_none":{"q05":35,"q25":43,"q50":50,"q75":56,"q95":64}},{"candidate_a":"le_pen_marine","candidate_b":"philippe_edouard","from":"bompard_manuel","to_a":{"q05":13,"q25":17,"q50":22,"q75":25,"q95":34},"to_b":{"q05":16,"q25":22,"q50":27,"q75":32,"q95":39},"to_none":{"q05":39,"q25":46,"q50":51,"q75":57,"q95":66}},{"candidate_a":"le_pen_marine","candidate_b":"philippe_edouard","from":"de_villiers_philippe","to_a":{"q05":60,"q25":67,"q50":73,"q75":79,"q95":86},"to_b":{"q05":5,"q25":7,"q50":9,"q75":10,"q95":14},"to_none":{"q05":10,"q25":13,"q50":17,"q75":23,"q95":28}},{"candidate_a":"le_pen_marine","candidate_b":"philippe_edouard","from":"knafo_sarah","to_a":{"q05":58,"q25":67,"q50":72,"q75":76,"q95":82},"to_b":{"q05":5,"q25":7,"q50":9,"q75":11,"q95":15},"to_none":{"q05":11,"q25":15,"q50":19,"q75":24,"q95":29}},{"candidate_a":"le_pen_marine","candidate_b":"philippe_edouard","from":"platret_gilles","to_a":{"q05":19,"q25":26,"q50":31,"q75":34,"q95":42},"to_b":{"q05":34,"q25":41,"q50":47,"q75":52,"q95":57},"to_none":{"q05":16,"q25":19,"q50":21,"q75":28,"q95":36}},{"candidate_a":"le_pen_marine","candidate_b":"melenchon_jean_luc","from":"philippe_edouard","to_a":{"q05":11,"q25":15,"q50":18,"q75":22,"q95":29},"to_b":{"q05":14,"q25":19,"q50":23,"q75":28,"q95":37},"to_none":{"q05":43,"q25":52,"q50":57,"q75":63,"q95":71}},{"candidate_a":"le_pen_marine","candidate_b":"melenchon_jean_luc","from":"attal_gabriel","to_a":{"q05":11,"q25":15,"q50":18,"q75":22,"q95":29},"to_b":{"q05":14,"q25":19,"q50":23,"q75":28,"q95":37},"to_none":{"q05":42,"q25":51,"q50":57,"q75":63,"q95":72}},{"candidate_a":"le_pen_marine","candidate_b":"melenchon_jean_luc","from":"glucksmann_raphael","to_a":{"q05":3,"q25":4,"q50":5,"q75":7,"q95":9},"to_b":{"q05":47,"q25":57,"q50":63,"q75":69,"q95":77},"to_none":{"q05":18,"q25":26,"q50":32,"q75":37,"q95":47}},{"candidate_a":"le_pen_marine","candidate_b":"melenchon_jean_luc","from":"retailleau_bruno","to_a":{"q05":38,"q25":48,"q50":55,"q75":62,"q95":71},"to_b":{"q05":3,"q25":4,"q50":5,"q75":6,"q95":8},"to_none":{"q05":25,"q25":33,"q50":40,"q75":47,"q95":57}},{"candidate_a":"le_pen_marine","candidate_b":"melenchon_jean_luc","from":"zemmour_eric","to_a":{"q05":62,"q25":69,"q50":75,"q75":79,"q95":85},"to_b":{"q05":3,"q25":5,"q50":6,"q75":8,"q95":11},"to_none":{"q05":11,"q25":15,"q50":19,"q75":23,"q95":31}},{"candidate_a":"le_pen_marine","candidate_b":"melenchon_jean_luc","from":"dupont_aignan_nicolas","to_a":{"q05":61,"q25":70,"q50":75,"q75":79,"q95":85},"to_b":{"q05":3,"q25":5,"q50":6,"q75":8,"q95":11},"to_none":{"q05":11,"q25":15,"q50":19,"q75":23,"q95":31}},{"candidate_a":"le_pen_marine","candidate_b":"melenchon_jean_luc","from":"bertrand_xavier","to_a":{"q05":39,"q25":49,"q50":56,"q75":62,"q95":70},"to_b":{"q05":3,"q25":4,"q50":5,"q75":6,"q95":8},"to_none":{"q05":26,"q25":33,"q50":39,"q75":46,"q95":56}},{"candidate_a":"le_pen_marine","candidate_b":"melenchon_jean_luc","from":"roussel_fabien","to_a":{"q05":6,"q25":9,"q50":11,"q75":14,"q95":20},"to_b":{"q05":42,"q25":52,"q50":58,"q75":64,"q95":73},"to_none":{"q05":17,"q25":24,"q50":29,"q75":35,"q95":45}},{"candidate_a":"le_pen_marine","candidate_b":"melenchon_jean_luc","from":"lassalle_jean","to_a":{"q05":19,"q25":26,"q50":31,"q